Sección;ID Sección;SKU Sección;SKU Name Sección;Nombre;Precio;SKU;SKU Name;Descripción;Imagen;ID;GTIN;Stock;Global Catalog ID;Indice
Café en grano;5752410;;;Orígen Perú 350 Grs;15500.0;;;350 grs de Café en grano, origen Perú, 100 porciento arábico, tueste reciente. Perú San Ignacio, notas a chocolate, sabor almendra y nuez. Lo quieres molido, entonces indícalo en las NOTAS PARA ESTE PRODUCTO.;https://images.deliveryhero.io/image/pedidosya/products/e9115335-3db8-4c85-a4f0-1b721e789bc9.jpeg;101069162;;;;1
Sándwich pastelería;5744450;;;Sandwich Miga Ave Mayo;3800.0;;;Sandwich miga Ave Mayo.;https://images.deliveryhero.io/image/pedidosya/products/ce0508b9-8b45-4439-9206-259f6bccd4cd.jpeg;101069204;;;;1
Café en grano;5752410;;;Orígen Colombia 350 Grs;19500.0;;;Café grano Colombia, 350 grs. 100 porciento arábico, tueste reciente, tueste medio. Aroma vainilla caramelo, sabor a lima y almendra. Lo quieres molido, entonces indícalo en las NOTAS PARA ESTE PRODUCTO.;https://images.deliveryhero.io/image/pedidosya/products/d9e6478f-64d5-4792-b388-df1caf0c7865.jpeg;101069718;;;;3
Café en grano;5752410;;;Origen Nicargua 350 Grs;16500.0;;;350 grs de Café en grano de Nicaragua. 100 porciento arábico, tueste medio, tueste reciente. Aroma a caramelo dulce, manzana madura, dulce a lima. Lo quieres molido, entonces indícalo en las NOTAS PARA ESTE PRODUCTO.;https://images.deliveryhero.io/image/pedidosya/products/cb644dfa-cd27-4490-8846-9df1c3ec2e74.jpeg;101069724;;;;2
Te Chai;5750978;;;Tiger Sin azucar;18000.0;;;Te Chai sin azucar;https://images.deliveryhero.io/image/pedidosya/products/289b12a6-6a0e-43c4-8bc8-fb9263bf4cb5.jpeg;101069728;;;;2
Te Chai;5750978;;;Chai Vainilla;18000.0;;;Chai sabor vainilla;https://images.deliveryhero.io/image/pedidosya/products/90a4297d-a89e-4736-9abc-027b2cd783e5.jpeg;101069731;;;;3
Te Chai;5750978;;;Chai Matcha;18000.0;;;Te Chai Matcha, te verde;https://images.deliveryhero.io/image/pedidosya/products/ab230d78-3c19-4924-b495-515bded618b2.jpeg;101069737;;;;4
Te Chai;5750978;;;Chai Te White;18000.0;;;Te blanco, Chai;https://images.deliveryhero.io/image/pedidosya/products/a9bc28d2-9bfc-46b3-a0e5-14906c3bfcd4.jpeg;101069742;;;;5
Te Chai;5750978;;;Chai Espresso;18000.0;;;Te con café espresso.;https://images.deliveryhero.io/image/pedidosya/products/810ea35b-65d4-47b9-b21d-b8b62f92817e.jpeg;101069748;;;;6
Te Chai;5750978;;;Chai Mango;18000.0;;;Te Chai Mango;https://images.deliveryhero.io/image/pedidosya/products/b48a3017-c46d-4b6b-8189-8a16c61b1e1e.jpeg;101069756;;;;8
Te Chai;5750978;;;Chai Spicer;18000.0;;;Te negro, receta original;https://images.deliveryhero.io/image/pedidosya/products/dc281ed2-a203-4344-be6c-fd64488b188d.jpeg;101069757;;;;9
Te Chai;5750978;;;Sin azucar;18000.0;;;Te chai sin azucar;https://images.deliveryhero.io/image/pedidosya/products/0a77673f-0bae-49ad-bdba-e7d82ec80d07.jpeg;101069763;;;;10
Bebestibles;6049010;;;Bebida Coca Cola Normal Botella;3500.0;;;Coca Cola 591 ml botella normal.;;109584517;;;;1
Bebestibles;6049010;;;Agua Mineral Sin Gas;3500.0;;;Agua minera sin gas .;https://images.deliveryhero.io/image/pedidosya/products/4b919cde-fe0c-4c21-bcd8-30593e05730b.png;109584528;;;;2
Bebestibles;6049010;;;Bebida Coca Cola Lata Light;2500.0;;;Coca Cola Lata Light 350 ml.;https://images.deliveryhero.io/image/pedidosya/products/6bf11802-4776-4a0e-9ee4-ab75bcc7f99b.jpg;109584535;;;;5
Bebestibles;6049010;;;Bebida Coca Cola Sin Azúcar Lata;2500.0;;;Coca Cola Lata sin azucar 350 ml.;https://images.deliveryhero.io/image/pedidosya/products/a25e9164-d816-4cce-bc01-50a360526981.jpg;109584543;;;;6
Bebestibles;6049010;;;Bebida Monster Energética Negra;3500.0;;;Monster energetica 473 ml Negra;https://images.deliveryhero.io/image/pedidosya/products/fa38c395-9afe-4982-9bf2-587e60694ca9.jpg;109584549;;;;7
Bebestibles;6049010;;;Bebida Coca Cola botella Zero;3500.0;;;Coca Cola botella Zero.;https://images.deliveryhero.io/image/pedidosya/products/55db9b59-cc22-48f6-8123-13a39bf57c68.jpeg;109584574;;;;3
Bebestibles;6049010;;;Agua Mineral Con Gas;3500.0;;;Agua mineral CON gas botella.;https://images.deliveryhero.io/image/pedidosya/products/062a8fb5-4eb8-4abe-8b68-bfa15b1755f5.png;109584584;;;;4
Sándwich pastelería;5744450;;;Trozo Torta Amor;6400.0;;;Bizcocho, manjar, frambuesa. Tamaño para compartir.;https://images.deliveryhero.io/image/pedidosya/products/7c98a085-bace-4d39-9aaa-95090e18c87b.jpeg;109584631;;;;3
Donut horneadas;6053860;;;BRIGADEIROS Unidad;2200.0;;;Producto de Brasil. Hecha con leche condensada, cubierta con chocolate belga. Hechas con manos de chef brasilero - BRIGADEIROS.;https://images.deliveryhero.io/image/pedidosya/products/fb121d72-110b-41f4-83bc-3f9a881ebb9c.jpeg;109616308;;;;1
Donut horneadas;6053860;;;Alfajor Vegano Mani Datiles;2400.0;;;Alfajor vegano, hecho con maní datiles.;https://images.deliveryhero.io/image/pedidosya/products/f50cce12-eb4a-4490-b3e6-d8563560cd18.jpeg;109616322;;;;7
Donut horneadas;6053860;;;Alfajor Vegano Frutilla;2400.0;;;Alfajor vegano relleno con frutilla.;https://images.deliveryhero.io/image/pedidosya/products/bf359dc8-2acd-4f2a-ba2d-e8a52a77c30f.jpeg;109616347;;;;8
Donut horneadas;6053860;;;Alfajor Vegano Manjar;2400.0;;;Vegano relleno Manjar.;https://images.deliveryhero.io/image/pedidosya/products/be1d15b4-b638-4db7-b918-a0a8fa85334b.jpeg;109616371;;;;9
Métodos preparación café;5744449;;;Espumador De Leche;16000.0;;;Espumador de leche 450 ml marca Vitrex de vidrio.;https://images.deliveryhero.io/image/pedidosya/products/b2d31755-e454-4866-bbf0-6cf809090357.jpeg;109616578;;;;2
Café en grano;5752410;;;Cafe Descafeinado Colombia 350 Grs;21000.0;;;Café Descafeinado Colombia tueste medio arábico.;https://images.deliveryhero.io/image/pedidosya/products/7c2d0fbb-2237-4d36-a0c0-56e27b8770a4.jpeg;109620446;;;;4
Sándwich pastelería;5744450;;;Kuchen Arandano-Frambuesa Mediando TANTE LLEVI;17800.0;;;Kuchen Mediano TANTE LLEVI, sabor Arándano Frambuesa. Strusel o Cremas. segun disponibilidad foto referencial.;https://images.deliveryhero.io/image/pedidosya/products/f40a78dc-7bdb-434a-abf1-aaa01af0808a.jpeg;109711002;;;;6
Sándwich pastelería;5744450;;;Kuchen Mango-Durazno Mediano TANTE LLEVI;17800.0;;;Kuchen TANTE LLEVI mediano Sabor Mango Durazno. Strusel o Cremas. segun disponibilidad. foto referencial.;https://images.deliveryhero.io/image/pedidosya/products/3c4e91ad-98ee-4d62-89ed-1d91c9d97ee3.jpeg;109711014;;;;7
Donut horneadas;6053860;;;Donut Rellena Crema Pastelera;2650.0;;;Donut rellena con suave crema pastelera horneada.;https://images.deliveryhero.io/image/pedidosya/products/a3045d6f-d154-41fb-8ed6-eebacd3d3bed.jpeg;109916639;;;;3
Donut horneadas;6053860;;;Donut Rellena Chocolate-Avellana;2650.0;;;Masa esponjosa rellena con abundante pasta de cacao y avellanas Horneadas.;https://images.deliveryhero.io/image/pedidosya/products/20eaa6c2-3628-44db-ab09-ab0388c7ee27.jpeg;109916667;;;;4
Donut horneadas;6053860;;;Donut Rellena Frambuesa;2650.0;;;Rellena con dulce de frambuesa y decorada con glaseado y chips de frambuesa. horneadas.;https://images.deliveryhero.io/image/pedidosya/products/fa92cc60-bfd9-4483-8716-a95a94508f38.jpeg;109916672;;;;7
Donut horneadas;6053860;;;Donut Rellena Chocorayas;2650.0;;;Suave cobertura de chocolate blanco y rellena de chocolate y crema de avellanas Horneadas.;https://images.deliveryhero.io/image/pedidosya/products/78c21e6c-f874-4042-9f42-ee9c6bd974bb.jpeg;109917020;;;;5
Donut horneadas;6053860;;;Donut No Rellena Dot The Rocks;2300.0;;;Esponjosa masa de sabor chocolate y cubierta de una gruesa capa de chocolate blanco y chips de chocolate Horneadas.;https://images.deliveryhero.io/image/pedidosya/products/4821ca40-a223-4e80-81a6-5caf1d0f4a0c.jpeg;109917312;;;;2
Sándwich pastelería;5744450;;;Sandwich Miga Jamon Queso;3800.0;;;Sandwich Miga Jamon Queso.;https://images.deliveryhero.io/image/pedidosya/products/6b889c87-0694-44c2-b1f1-ae88c28ed406.jpeg;110531476;;;;2
Sándwich pastelería;5744450;;;Trozo Torta SIN AZUCAR Zanahoria;7900.0;;;Torta Sin Azucar Zanahoria, con alulosa y cubierta con frosting.;https://images.deliveryhero.io/image/pedidosya/products/518da6ba-9bb8-429f-9e48-46fe8c7e8f4d.jpeg;111500918;;;;4
Café en grano;5752410;;;Origen Peru 1 Kilo;35000.0;;;Café grano Peru 1 kilo.;https://images.deliveryhero.io/image/pedidosya/products/6f0090c9-ff93-429b-aa31-eced3f0ee6c1.jpeg;112062139;;;;5
Café en grano;5752410;;;Origen Nicaragua 1 Kilo;38000.0;;;Café grano Nicaragua 1 kilo.;https://images.deliveryhero.io/image/pedidosya/products/4af350f1-9843-4d0a-a475-c8467f3799a9.jpeg;112062145;;;;6
Café en grano;5752410;;;Origen Colombia 1 Kilo;45000.0;;;Café grano Colombia 1 kilo.;https://images.deliveryhero.io/image/pedidosya/products/785ae6e1-fda8-4183-9c10-5febe563ad33.jpeg;112062172;;;;7
Sándwich pastelería;5744450;;;Trozo Kuchen Variedades;5900.0;;;Trozo Kuchen segun disponibilidad TANTE LLEVI. Arandano frambuesa o Manzana. Strusel o Cremas. segun disponibilidad.;https://images.deliveryhero.io/image/pedidosya/products/4a20d07e-f836-4fec-8a40-dfc82f0a2cab.jpeg;112064594;;;;10
Sándwich pastelería;5744450;;;Trozo Torta Pompadour De Plátano;6400.0;;;Combinación de sabrosas hojas de masa con manjar y crema. Conocida tambien como la torta de plátano.;https://images.deliveryhero.io/image/pedidosya/products/732d8963-b221-4205-b94f-6962aa7410f5.jpeg;118854290;;;;5
Sándwich pastelería;5744450;;;Kuchen Manzana-Frambuesa Mediano TANTE LLEVI;17800.0;;;Kuchen TANTELLEVI Mediano Sabor Manzana Frambuesa. Strusel o Cremas. segun disponibilidad. foto referencial.;;120467121;;;;8
Sándwich pastelería;5744450;;;Trozo Kuchen Nuez;4700.0;;;1 trozo de Kuchen de nuez.;https://images.deliveryhero.io/image/pedidosya/products/45757c02-067b-4752-90ca-d99cee329098.jpeg;120964643;;;;11
